{
  "version": 1,
  "root": { "id": "baam-test", "name": "BAAM Test", "url": "https://baam.pro/" },
  "territories": [
    {
      "id": "games",
      "name": "Games",
      "color": "#ff4268",
      "description": ["Jeux en mouvement", "Systèmes à éprouver"],
      "featuredAssets": ["jeu-video"]
    }
  ],
  "assets": [
    {
      "id": "jeu-video",
      "territory": "games",
      "title": "Jeu vidéo",
      "type": "Jeu",
      "status": "preview",
      "updatedAt": "2026-10-03",
      "url": "https://jeu.games.baam.pro/",
      "preview": {
        "type": "video",
        "poster": "https://jeu.games.baam.pro/preview.webp",
        "width": 1280,
        "height": 720,
        "alt": "Une partie du jeu en cours.",
        "sources": [
          { "url": "https://jeu.games.baam.pro/preview.webm", "type": "video/webm" },
          { "url": "https://jeu.games.baam.pro/preview.mp4", "type": "video/mp4" }
        ]
      },
      "relations": []
    }
  ]
}
